{"$schema": "http://json-schema.org/schema#", "type": "object", "properties": {"name": {"type": "string"}, "date_born": {"type": "string"}, "place_born": {"anyOf": [{"type": "null"}, {"type": "string"}]}, "profession": {"anyOf": [{"type": "null"}, {"type": "string"}]}, "lang": {"anyOf": [{"type": "null"}, {"type": "string"}]}, "party": {"type": "string"}, "email": {"title": "Email address", "type": "string", "pattern": "^\\S+@\\S+\\.\\S+$", "format": "email", "minLength": 6, "maxLength": 127}, "url": {"type": "string"}, "education": {"anyOf": [{"type": "null"}, {"type": "string"}]}, "pp": {"type": "string"}, "dob": {"type": "string"}}, "required": ["date_born", "dob", "education", "email", "lang", "name", "party", "place_born", "pp", "profession", "url"], "title": "Welcome"}